{
  "endpoint": "my_device",
  "registrationId": "Hq5sYb6YE3",
  "registrationDate": 1715613881744,
  "lastUpdate": 1715613881744,
  "address": "154.43.164.20:22699",
  "lwM2mVersion": "1.0",
  "lifetime": 600,
  "bindingMode": "U",
  "rootPath": "/",
  "objectLinks": [
    {
      "url": "/1/0",
      "attributes": {}
    },
    {
      "url": "/3/0",
      "attributes": {}
    },
    {
      "url": "/4",
      "attributes": {
        "ver": "1.2"
      }
    },
    {
      "url": "/4/0",
      "attributes": {}
    },
    {
      "url": "/5/0",
      "attributes": {}
    },
    {
      "url": "/9/0",
      "attributes": {}
    },
    {
      "url": "/25",
      "attributes": {
        "ver": "2.0"
      }
    },
    {
      "url": "/27038/0",
      "attributes": {}
    },
    {
      "url": "/27039/0",
      "attributes": {}
    }
  ],
  "secure": false,
  "additionalRegistrationAttributes": {},
  "queuemode": false,
  "availableInstances": {
    "1": [
      0
    ],
    "3": [
      0
    ],
    "4": [
      0
    ],
    "5": [
      0
    ],
    "9": [
      0
    ],
    "27038": [
      0
    ],
    "27039": [
      0
    ]
  }
}
